{
  "study_id": "sleep_apnea",
  "schema_version": "1.0",
  "collection_timestamp": "2026-01-23T09:28:59.673334Z",
  "metadata": {
    "domain": "sleep medicine",
    "databases": [
      "pubmed",
      "scopus",
      "wos",
      "embase"
    ],
    "num_queries": 12,
    "date_range": {
      "start": "1900-01-01",
      "end": "2021-03-01"
    },
    "has_embase": false,
    "gold_size": 11
  },
  "gold_standard": {
    "pmids": [
      "32045010",
      "31464350",
      "30735921",
      "28738188",
      "28408829",
      "26765405",
      "25810019",
      "26156952",
      "25794635",
      "24205289",
      "21828324"
    ],
    "count": 11
  },
  "aggregation_strategies": [
    {
      "name": "consensus_k2",
      "recall": 0.2727272727272727,
      "precision": 0.0416666666666666,
      "f1": 0.072289156626506,
      "jaccard": 0.0375,
      "overlap_coeff": 0.2727272727272727,
      "retrieved_count": 72,
      "true_positives": 3,
      "false_negatives": 8
    },
    {
      "name": "two_stage_screen",
      "recall": 0.3636363636363636,
      "precision": 0.0283687943262411,
      "f1": 0.0526315789473684,
      "jaccard": 0.027027027027027,
      "overlap_coeff": 0.3636363636363636,
      "retrieved_count": 141,
      "true_positives": 4,
      "false_negatives": 7
    },
    {
      "name": "precision_gated_union",
      "recall": 1.0,
      "precision": 0.0056093829678735,
      "f1": 0.011156186612576,
      "jaccard": 0.0056093829678735,
      "overlap_coeff": 1.0,
      "retrieved_count": 1961,
      "true_positives": 11,
      "false_negatives": 0
    },
    {
      "name": "time_stratified_hybrid",
      "recall": 1.0,
      "precision": 0.0056093829678735,
      "f1": 0.011156186612576,
      "jaccard": 0.0056093829678735,
      "overlap_coeff": 1.0,
      "retrieved_count": 1961,
      "true_positives": 11,
      "false_negatives": 0
    },
    {
      "name": "weighted_vote",
      "recall": 1.0,
      "precision": 0.0056093829678735,
      "f1": 0.011156186612576,
      "jaccard": 0.0056093829678735,
      "overlap_coeff": 1.0,
      "retrieved_count": 1961,
      "true_positives": 11,
      "false_negatives": 0
    }
  ],
  "source_files": {
    "aggregates_csv": "aggregates_eval/sleep_apnea/sets_summary_20260115-143544.csv",
    "gold_standard_csv": "studies/sleep_apnea/gold_pmids_sleep_apnea.csv",
    "benchmark_csv": "benchmark_outputs/sleep_apnea/summary_20251121-150455.csv"
  },
  "query_performance": [
    {
      "query_text": "(((\"Sleep Apnea Syndromes\"[Mesh]) OR (\"Sleep Apnea, Obstructive\"[Mesh]) OR (\"Sleep Apnea, Central\"[Mesh])) AND ((\"Dementia\"[Mesh]) OR (\"Alzheimer Disease\"[Mesh]) OR (\"Lewy Body Disease\"[Mesh]) OR (\"Dementia, Vascular\"[Mesh]) OR (\"Frontotemporal Dementia\"[Mesh]) OR (\"Parkinson Disease\"[Mesh]) OR (\"Cognitive Dysfunction\"[Mesh]))) AND (\"2010/04/01\"[Date - Publication] : \"2021/03/01\"[Date - Publication])",
      "results_count": 5053,
      "true_positives": 7,
      "recall": 0.6363636363636364,
      "nnr_proxy": 721.8571428571429
    },
    {
      "query_text": "((\"sleep apnea\"[tiab] OR \"sleep apnoea\"[tiab] OR \"sleep-disordered breathing\"[tiab] OR \"sleep disordered breathing\"[tiab] OR \"SDB\"[tiab] OR \"obstructive sleep apnea\"[tiab] OR \"obstructive sleep apnoea\"[tiab] OR \"OSA\"[tiab] OR \"hypopnea\"[tiab] OR \"hypopnoea\"[tiab] OR \"apnea-hypopnea index\"[tiab] OR \"AHI\"[tiab]) AND (\"dementia*\"[tiab] OR \"Alzheimer's disease\"[tiab] OR \"Alzheimer disease\"[tiab] OR \"AD\"[tiab] OR \"Lewy body*\"[tiab] OR \"vascular dementia\"[tiab] OR \"frontotemporal dementia\"[tiab] OR \"FTD\"[tiab] OR \"cognitive decline\"[tiab] OR \"cognitive impairment\"[tiab] OR \"neurocognitive disorder*\"[tiab])) AND (\"2010/04/01\"[Date - Publication] : \"2021/03/01\"[Date - Publication])",
      "results_count": 6032,
      "true_positives": 6,
      "recall": 0.5454545454545454,
      "nnr_proxy": 1005.3333333333334
    },
    {
      "query_text": "(((\"Sleep Apnea Syndromes\"[Mesh]) OR \"sleep apnea\"[tiab] OR \"sleep apnoea\"[tiab] OR \"sleep-disordered breathing\"[tiab] OR \"obstructive sleep apnea\"[tiab]) AND ((\"Dementia\"[Mesh]) OR \"dementia*\"[tiab] OR \"Alzheimer Disease\"[Mesh] OR \"Alzheimer's disease\"[tiab] OR \"cognitive decline\"[tiab] OR \"cognitive impairment\"[tiab])) AND (\"2010/04/01\"[Date - Publication] : \"2021/03/01\"[Date - Publication])",
      "results_count": 5187,
      "true_positives": 6,
      "recall": 0.5454545454545454,
      "nnr_proxy": 864.5
    },
    {
      "query_text": "((\"sleep apnea\"[tiab] OR \"sleep apnoea\"[tiab] OR \"sleep-disordered breathing\"[tiab] OR \"sleep disordered breathing\"[tiab] OR \"obstructive sleep apnea\"[tiab] OR \"obstructive sleep apnoea\"[tiab] OR \"hypopnea\"[tiab] OR \"hypopnoea\"[tiab] OR \"apnea-hypopnea index\"[tiab]) AND (\"dementia*\"[tiab] OR \"Alzheimer's disease\"[tiab] OR \"Alzheimer disease\"[tiab] OR (\"Lewy body\"[tiab] AND dementia[tiab]) OR \"vascular dementia\"[tiab] OR \"frontotemporal dementia\"[tiab] OR \"cognitive decline\"[tiab] OR \"cognitive impairment\"[tiab] OR \"neurocognitive disorder*\"[tiab])) AND (\"2010/04/01\"[Date - Publication] : \"2021/03/01\"[Date - Publication])",
      "results_count": 5363,
      "true_positives": 6,
      "recall": 0.5454545454545454,
      "nnr_proxy": 893.8333333333334
    },
    {
      "query_text": "(((\"Sleep Apnea Syndromes\"[Mesh]) OR \"sleep apnea\"[tiab] OR \"sleep apnoea\"[tiab] OR \"sleep-disordered breathing\"[tiab]) AND ((\"Dementia\"[Mesh]) OR \"dementia*\"[tiab] OR \"Alzheimer Disease\"[Mesh] OR \"Alzheimer's disease\"[tiab] OR \"Lewy Body Disease\"[Mesh] OR \"Dementia, Vascular\"[Mesh] OR \"cognitive decline\"[tiab])) AND (\"2010/04/01\"[Date - Publication] : \"2021/03/01\"[Date - Publication])",
      "results_count": 3676,
      "true_positives": 6,
      "recall": 0.5454545454545454,
      "nnr_proxy": 612.6666666666666
    }
  ]
}