{
  "study_id": "ai_2022",
  "schema_version": "1.0",
  "collection_timestamp": "2026-01-23T09:49:59.332928Z",
  "metadata": {
    "domain": "artificial intelligence",
    "databases": [
      "pubmed",
      "scopus",
      "wos",
      "embase"
    ],
    "num_queries": 12,
    "date_range": {
      "start": "1990-01-01",
      "end": "2024-12-31"
    },
    "has_embase": true,
    "gold_size": 14
  },
  "gold_standard": {
    "pmids": [
      "14764433",
      "18071053",
      "18838624",
      "32209641",
      "32851326",
      "34160576",
      "21708802",
      "31927221",
      "20648668",
      "27939257",
      "18388205",
      "19286627",
      "19732317",
      "21521626"
    ],
    "count": 14
  },
  "aggregation_strategies": [
    {
      "name": "consensus_k2",
      "recall": 0.3571428571428571,
      "precision": 0.0102459016393442,
      "f1": 0.0199203187250996,
      "jaccard": 0.0100603621730382,
      "overlap_coeff": 0.3571428571428571,
      "retrieved_count": 488,
      "true_positives": 5,
      "false_negatives": 9
    },
    {
      "name": "precision_gated_union",
      "recall": 0.3571428571428571,
      "precision": 0.0089928057553956,
      "f1": 0.0175438596491228,
      "jaccard": 0.0088495575221238,
      "overlap_coeff": 0.3571428571428571,
      "retrieved_count": 556,
      "true_positives": 5,
      "false_negatives": 9
    },
    {
      "name": "time_stratified_hybrid",
      "recall": 0.3571428571428571,
      "precision": 0.0089928057553956,
      "f1": 0.0175438596491228,
      "jaccard": 0.0088495575221238,
      "overlap_coeff": 0.3571428571428571,
      "retrieved_count": 556,
      "true_positives": 5,
      "false_negatives": 9
    },
    {
      "name": "two_stage_screen",
      "recall": 0.3571428571428571,
      "precision": 0.0089928057553956,
      "f1": 0.0175438596491228,
      "jaccard": 0.0088495575221238,
      "overlap_coeff": 0.3571428571428571,
      "retrieved_count": 556,
      "true_positives": 5,
      "false_negatives": 9
    },
    {
      "name": "weighted_vote",
      "recall": 0.3571428571428571,
      "precision": 0.0089928057553956,
      "f1": 0.0175438596491228,
      "jaccard": 0.0088495575221238,
      "overlap_coeff": 0.3571428571428571,
      "retrieved_count": 556,
      "true_positives": 5,
      "false_negatives": 9
    }
  ],
  "source_files": {
    "aggregates_csv": "aggregates_eval/ai_2022/sets_summary_20260121-093646.csv",
    "gold_standard_csv": "studies/ai_2022/gold_pmids_ai_2022.csv",
    "benchmark_csv": "benchmark_outputs/ai_2022/summary_20260121-093645.csv"
  },
  "query_performance": [
    {
      "query_text": "((((\"Sleep Apnea Syndromes\"[Mesh] OR \"Snoring\"[Mesh]) OR (\"sleep disordered breathing\"[tiab] OR \"sleep apnea\"[tiab] OR \"SDB\"[tiab] OR \"obstructive sleep apnea\"[tiab] OR \"OSA\"[tiab] OR \"snoring\"[tiab])) AND ((\"Blood Pressure\"[Mesh] OR \"Hypertension\"[Mesh]) OR (\"blood pressure\"[tiab] OR \"hypertension\"[tiab] OR \"BP\"[tiab] OR \"nondipping\"[tiab] OR \"non-dipping\"[tiab])) AND ((\"Child\"[Mesh] OR \"Adolescent\"[Mesh] OR \"Infant\"[Mesh]) OR (\"child*\"[tiab] OR \"adolescen*\"[tiab] OR \"p*ediatric\"[tiab] OR \"infan*\"[tiab] OR \"teen*\"[tiab]))) AND (\"1990/01/01\"[Date - Publication] : \"2024/12/31\"[Date - Publication])",
      "results_count": 552,
      "true_positives": 5,
      "recall": 0.3571428571428571,
      "nnr_proxy": 110.4
    },
    {
      "query_text": "(((\"Sleep Apnea Syndromes\"[Mesh]) OR (\"sleep disordered breathing\"[tiab] OR \"sleep apnea\"[tiab] OR \"snoring\"[tiab])) AND ((\"Blood Pressure\"[Mesh]) OR (\"blood pressure\"[tiab] OR \"hypertension\"[tiab])) AND ((\"Child\"[Mesh] OR \"Adolescent\"[Mesh]) OR (\"child*\"[tiab] OR \"adolescen*\"[tiab] OR \"pediatric\"[tiab]))) AND (\"1990/01/01\"[Date - Publication] : \"2024/12/31\"[Date - Publication])",
      "results_count": 491,
      "true_positives": 5,
      "recall": 0.3571428571428571,
      "nnr_proxy": 98.2
    },
    {
      "query_text": "(((\"Sleep Apnea, Obstructive\"[majr] OR \"Snoring\"[majr]) OR (\"sleep disordered breathing\"[ti] OR \"obstructive sleep apnea\"[ti])) AND ((\"Hypertension\"[majr]) OR (\"blood pressure\"[ti] OR \"hypertension\"[ti])) AND ((\"Child\"[majr] OR \"Adolescent\"[majr]) OR (\"pediatric\"[ti] OR \"child\"[ti]))) AND (\"1990/01/01\"[Date - Publication] : \"2024/12/31\"[Date - Publication])",
      "results_count": 10,
      "true_positives": 1,
      "recall": 0.0714285714285714,
      "nnr_proxy": 10.0
    },
    {
      "query_text": "(((\"Sleep Apnea Syndromes\"[Mesh]) OR (\"sleep disordered breathing\"[tiab] OR \"sleep apnea\"[tiab] OR \"snoring\"[tiab])) AND ((\"Blood Pressure\"[Mesh]) OR (\"blood pressure\"[tiab] OR \"hypertension\"[tiab])) AND ((\"Child\"[Mesh] OR \"Adolescent\"[Mesh]) OR (\"child*\"[tiab] OR \"adolescen*\"[tiab] OR \"pediatric\"[tiab]))) AND (\"1990/01/01\"[Date - Publication] : \"2024/12/31\"[Date - Publication]) AND (humans[Filter] AND english[Filter])",
      "results_count": 410,
      "true_positives": 4,
      "recall": 0.2857142857142857,
      "nnr_proxy": 102.5
    },
    {
      "query_text": "(((\"Sleep Apnea Syndromes\"[Mesh]) OR (\"sleep disordered breathing\"[ti] OR \"sleep apnea\"[ti] OR \"snoring\"[ti])) AND ((\"Blood Pressure\"[Mesh]) OR (\"blood pressure\"[ti] OR \"hypertension\"[ti])) AND ((\"Child\"[Mesh] OR \"Adolescent\"[Mesh]) OR (\"child*\"[tiab] OR \"adolescen*\"[tiab] OR \"pediatric\"[tiab]))) AND (\"1990/01/01\"[Date - Publication] : \"2024/12/31\"[Date - Publication])",
      "results_count": 141,
      "true_positives": 5,
      "recall": 0.3571428571428571,
      "nnr_proxy": 28.2
    },
    {
      "query_text": "(((\"Sleep Apnea Syndromes\"[majr]) OR (\"sleep disordered breathing\"[tiab] OR \"sleep apnea\"[tiab] OR \"snoring\"[tiab])) AND ((\"Blood Pressure\"[majr]) OR (\"blood pressure\"[tiab] OR \"hypertension\"[tiab])) AND ((\"Child\"[Mesh] OR \"Adolescent\"[Mesh]) OR (\"child*\"[tiab] OR \"adolescen*\"[tiab] OR \"pediatric\"[tiab]))) AND (\"1990/01/01\"[Date - Publication] : \"2024/12/31\"[Date - Publication])",
      "results_count": 477,
      "true_positives": 5,
      "recall": 0.3571428571428571,
      "nnr_proxy": 95.4
    }
  ]
}