{
  "study_id": "Godos_2024",
  "schema_version": "1.0",
  "collection_timestamp": "2026-04-09T07:37:46.298056Z",
  "metadata": {
    "domain": "nutrition",
    "databases": [
      "pubmed",
      "scopus",
      "wos",
      "embase"
    ],
    "num_queries": 12,
    "has_embase": true,
    "gold_size": 23
  },
  "gold_standard": {
    "pmids": [
      "20808113",
      "28364422",
      "30137563",
      "30187649",
      "31035395",
      "30306634",
      "31071943",
      "32165704",
      "32817391",
      "32397621",
      "31957658",
      "32947817",
      "33892688",
      "34205057",
      "35056325",
      "36540581",
      "34942284",
      "35248010",
      "32951762",
      "33031478",
      "33813674",
      "36226971",
      "35512773"
    ],
    "count": 23
  },
  "aggregation_strategies": [
    {
      "name": "consensus_k2",
      "recall": 0.6521739130434783,
      "precision": 0.0112951807228915,
      "f1": 0.0222057735011102,
      "jaccard": 0.0112275449101796,
      "overlap_coeff": 0.6521739130434783,
      "retrieved_count": 1328,
      "true_positives": 15,
      "false_negatives": 8
    },
    {
      "name": "precision_gated_union",
      "recall": 0.8260869565217391,
      "precision": 0.0040503091025367,
      "f1": 0.0080610946117946,
      "jaccard": 0.0040468583599574,
      "overlap_coeff": 0.8260869565217391,
      "retrieved_count": 4691,
      "true_positives": 19,
      "false_negatives": 4
    },
    {
      "name": "time_stratified_hybrid",
      "recall": 0.8260869565217391,
      "precision": 0.0040503091025367,
      "f1": 0.0080610946117946,
      "jaccard": 0.0040468583599574,
      "overlap_coeff": 0.8260869565217391,
      "retrieved_count": 4691,
      "true_positives": 19,
      "false_negatives": 4
    },
    {
      "name": "two_stage_screen",
      "recall": 0.8260869565217391,
      "precision": 0.0040503091025367,
      "f1": 0.0080610946117946,
      "jaccard": 0.0040468583599574,
      "overlap_coeff": 0.8260869565217391,
      "retrieved_count": 4691,
      "true_positives": 19,
      "false_negatives": 4
    },
    {
      "name": "weighted_vote",
      "recall": 0.8260869565217391,
      "precision": 0.0040503091025367,
      "f1": 0.0080610946117946,
      "jaccard": 0.0040468583599574,
      "overlap_coeff": 0.8260869565217391,
      "retrieved_count": 4691,
      "true_positives": 19,
      "false_negatives": 4
    }
  ],
  "source_files": {
    "aggregates_csv": "aggregates_eval/Godos_2024/sets_summary_20260327-105155.csv",
    "gold_standard_csv": "studies/Godos_2024/gold_pmids_Godos_2024.csv",
    "benchmark_csv": "benchmark_outputs/Godos_2024/summary_20260327-105154.csv"
  },
  "query_performance": [
    {
      "query_text": "((\"Diet, Mediterranean\"[Mesh] OR \"mediterranean diet\"[tiab] OR \"mediterranean diet adherence\"[tiab] OR ((fruit*[tiab] OR vegetable*[tiab] OR cereal*[tiab] OR legume*[tiab] OR \"dairy product\"[tiab] OR \"dairy products\"[tiab] OR fish[tiab] OR meat[tiab] OR \"olive oil\"[tiab] OR alcohol[tiab]) AND (diet*[tiab] OR intake[tiab] OR consumption[tiab]))) AND (\"Sleep\"[Mesh] OR \"Somnolence\"[Mesh] OR sleep[tiab] OR \"sleep quality\"[tiab] OR \"sleep duration\"[tiab] OR \"daytime sleepiness\"[tiab] OR sleepiness[tiab] OR somnolence[tiab]))",
      "results_count": 9272,
      "true_positives": 23,
      "recall": 1.0,
      "nnr_proxy": 403.1304347826087
    },
    {
      "query_text": "((\"Diet, Mediterranean\"[Mesh] OR \"mediterranean diet\"[tiab] OR \"mediterranean diet adherence\"[tiab] OR ((legume*[tiab] OR fish[tiab] OR \"olive oil\"[tiab] OR alcohol[tiab]) AND (diet*[tiab] OR intake[tiab] OR consumption[tiab]))) AND (\"Sleep\"[Mesh] OR sleep[tiab] OR \"sleep quality\"[tiab] OR \"sleep duration\"[tiab] OR \"daytime sleepiness\"[tiab] OR sleepiness[tiab]) AND (\"Adult\"[Mesh] OR adult*[tiab]))",
      "results_count": 5229,
      "true_positives": 22,
      "recall": 0.9565217391304348,
      "nnr_proxy": 237.6818181818182
    },
    {
      "query_text": "(((\"Diet, Mediterranean\"[Majr] OR \"mediterranean diet\"[ti] OR \"mediterranean diet adherence\"[ti]) AND (\"sleep quality\"[ti] OR \"sleep duration\"[ti] OR \"daytime sleepiness\"[ti] OR sleep[ti])) AND (\"Adult\"[Mesh] OR adult*[tiab]))",
      "results_count": 113,
      "true_positives": 14,
      "recall": 0.6086956521739131,
      "nnr_proxy": 8.071428571428571
    },
    {
      "query_text": "((\"mediterranean diet\"[ti] OR \"mediterranean diet adherence\"[ti]) AND (\"sleep quality\"[ti] OR \"sleep duration\"[ti] OR \"daytime sleepiness\"[ti] OR sleep[ti]) AND (\"Adult\"[Mesh] OR adult*[tiab]))",
      "results_count": 49,
      "true_positives": 7,
      "recall": 0.3043478260869565,
      "nnr_proxy": 7.0
    },
    {
      "query_text": "(((\"Diet, Mediterranean\"[Mesh] OR \"mediterranean diet\"[tiab] OR \"mediterranean diet adherence\"[tiab] OR ((legume*[tiab] OR fish[tiab] OR \"olive oil\"[tiab] OR alcohol[tiab]) AND (diet*[tiab] OR intake[tiab] OR consumption[tiab]))) AND (\"Sleep\"[Mesh] OR sleep[tiab] OR \"sleep quality\"[tiab] OR \"sleep duration\"[tiab] OR \"daytime sleepiness\"[tiab] OR sleepiness[tiab]) AND (\"Adult\"[Mesh] OR adult*[tiab])) AND humans[Filter]) NOT (review[pt] OR meta-analysis[pt] OR letter[pt] OR editorial[pt] OR comment[pt])",
      "results_count": 1748,
      "true_positives": 21,
      "recall": 0.9130434782608696,
      "nnr_proxy": 83.23809523809524
    },
    {
      "query_text": "((((\"Diet, Mediterranean\"[Mesh] OR \"mediterranean diet\"[tiab] OR \"mediterranean diet adherence\"[tiab] OR ((legume*[tiab] OR fish[tiab] OR \"olive oil\"[tiab] OR alcohol[tiab]) AND (diet*[tiab] OR intake[tiab] OR consumption[tiab]))) AND (\"Sleep\"[Mesh] OR sleep[tiab] OR \"sleep quality\"[tiab] OR \"sleep duration\"[tiab] OR \"daytime sleepiness\"[tiab] OR sleepiness[tiab]) AND (\"Adult\"[Mesh] OR adult*[tiab])) AND (cohort[tiab] OR observational[tiab] OR \"cross-sectional\"[tiab] OR \"case-control\"[tiab])) AND humans[Filter]) NOT (review[pt] OR meta-analysis[pt] OR letter[pt] OR editorial[pt] OR comment[pt])",
      "results_count": 5224,
      "true_positives": 19,
      "recall": 0.8260869565217391,
      "nnr_proxy": 274.94736842105266
    }
  ]
}